{
  "schemaVersion": 2,
  "identity": {
    "owner": "nekojs-core",
    "kind": "PORTABLE",
    "contractId": "portable-core",
    "version": "0.9.0"
  },
  "docs": "NekoJS portable Platform, ID, Text, JsonIO, in-memory NBT, compressed binary NBT, registry query, stable event contract (T0 script lifecycle + T1 server/level/player/command lifecycle + T2 registry events item/block/entityType/fluid/creativeModeTab/soundEvent/mobEffect/potion/villagerType/enchantment).",
  "errors": [
    {
      "code": "UNSUPPORTED_CAPABILITY",
      "fields": [
        "symbolId",
        "requiredCapability",
        "platform",
        "minecraftVersion"
      ]
    },
    {
      "code": "UNSUPPORTED_MODULE",
      "fields": [
        "symbolId",
        "platform",
        "minecraftVersion"
      ]
    },
    {
      "code": "INVALID_REFERENCE",
      "fields": [
        "symbolId",
        "platform",
        "minecraftVersion"
      ]
    },
    {
      "code": "API_CONTRACT_VIOLATION",
      "fields": [
        "symbolId",
        "platform",
        "minecraftVersion"
      ]
    },
    {
      "code": "DUPLICATE_API_SYMBOL",
      "fields": [
        "symbolId",
        "platform",
        "minecraftVersion"
      ]
    },
    {
      "code": "DUPLICATE_CAPABILITY_PROVIDER",
      "fields": [
        "symbolId",
        "requiredCapability",
        "platform",
        "minecraftVersion"
      ]
    },
    {
      "code": "NATIVE_TYPE_LEAK",
      "fields": [
        "symbolId",
        "platform",
        "minecraftVersion"
      ]
    },
    {
      "code": "STALE_API_MANIFEST",
      "fields": [
        "symbolId",
        "replacement",
        "platform",
        "minecraftVersion"
      ]
    },
    {
      "code": "NO_MATCHING_SIGNATURE",
      "fields": [
        "symbolId",
        "platform",
        "minecraftVersion"
      ]
    },
    {
      "code": "AMBIGUOUS_CALL",
      "fields": [
        "symbolId",
        "platform",
        "minecraftVersion"
      ]
    },
    {
      "code": "TYPE_MISMATCH",
      "fields": [
        "symbolId",
        "platform",
        "minecraftVersion"
      ]
    },
    {
      "code": "CALLBACK_NOT_EXECUTABLE",
      "fields": [
        "symbolId",
        "platform",
        "minecraftVersion"
      ]
    },
    {
      "code": "INVOCATION_ERROR",
      "fields": [
        "symbolId",
        "platform",
        "minecraftVersion"
      ]
    },
    {
      "code": "INVALID_JSON",
      "fields": [
        "symbolId",
        "platform",
        "minecraftVersion",
        "path",
        "operation"
      ]
    },
    {
      "code": "JSON_LIMIT_EXCEEDED",
      "fields": [
        "symbolId",
        "platform",
        "minecraftVersion",
        "path",
        "operation",
        "limit"
      ]
    },
    {
      "code": "JSON_PATH_FORBIDDEN",
      "fields": [
        "symbolId",
        "platform",
        "minecraftVersion",
        "path",
        "operation"
      ]
    },
    {
      "code": "JSON_FILE_TOO_LARGE",
      "fields": [
        "symbolId",
        "platform",
        "minecraftVersion",
        "path",
        "operation",
        "limit"
      ]
    },
    {
      "code": "JSON_IO_ERROR",
      "fields": [
        "symbolId",
        "platform",
        "minecraftVersion",
        "path",
        "operation"
      ]
    },
    {
      "code": "JSON_ATOMIC_WRITE_FAILED",
      "fields": [
        "symbolId",
        "platform",
        "minecraftVersion",
        "path",
        "operation"
      ]
    },
    {
      "code": "INVALID_NBT",
      "fields": [
        "symbolId",
        "platform",
        "minecraftVersion",
        "path",
        "operation"
      ]
    },
    {
      "code": "NBT_LIMIT_EXCEEDED",
      "fields": [
        "symbolId",
        "platform",
        "minecraftVersion",
        "path",
        "operation",
        "limit"
      ]
    },
    {
      "code": "NBT_PATH_FORBIDDEN",
      "fields": [
        "symbolId",
        "platform",
        "minecraftVersion",
        "path",
        "operation"
      ]
    },
    {
      "code": "NBT_FILE_TOO_LARGE",
      "fields": [
        "symbolId",
        "platform",
        "minecraftVersion",
        "path",
        "operation",
        "limit"
      ]
    },
    {
      "code": "NBT_IO_ERROR",
      "fields": [
        "symbolId",
        "platform",
        "minecraftVersion",
        "path",
        "operation"
      ]
    },
    {
      "code": "NBT_ATOMIC_WRITE_FAILED",
      "fields": [
        "symbolId",
        "platform",
        "minecraftVersion",
        "path",
        "operation"
      ]
    }
  ],
  "symbols": [
    {
      "id": "global:ID",
      "signatures": [
        {
          "parameters": [],
          "returnType": {
            "kind": "PRIMITIVE",
            "name": "object"
          }
        }
      ]
    },
    {
      "id": "member:ID.of",
      "signatures": [
        {
          "parameters": [
            {
              "name": "value",
              "type": {
                "kind": "PRIMITIVE",
                "name": "string"
              }
            }
          ],
          "returnType": {
            "kind": "SYMBOL",
            "name": "type:NekoId"
          }
        },
        {
          "parameters": [
            {
              "name": "namespace",
              "type": {
                "kind": "PRIMITIVE",
                "name": "string"
              }
            },
            {
              "name": "path",
              "type": {
                "kind": "PRIMITIVE",
                "name": "string"
              }
            }
          ],
          "returnType": {
            "kind": "SYMBOL",
            "name": "type:NekoId"
          }
        }
      ]
    },
    {
      "id": "member:ID.namespace",
      "signatures": [
        {
          "parameters": [
            {
              "name": "id",
              "type": {
                "kind": "SYMBOL",
                "name": "type:NekoId"
              }
            }
          ],
          "returnType": {
            "kind": "PRIMITIVE",
            "name": "string"
          }
        }
      ]
    },
    {
      "id": "member:ID.path",
      "signatures": [
        {
          "parameters": [
            {
              "name": "id",
              "type": {
                "kind": "SYMBOL",
                "name": "type:NekoId"
              }
            }
          ],
          "returnType": {
            "kind": "PRIMITIVE",
            "name": "string"
          }
        }
      ]
    },
    {
      "id": "member:ID.asString",
      "signatures": [
        {
          "parameters": [
            {
              "name": "id",
              "type": {
                "kind": "SYMBOL",
                "name": "type:NekoId"
              }
            }
          ],
          "returnType": {
            "kind": "PRIMITIVE",
            "name": "string"
          }
        }
      ]
    },
    {
      "id": "member:NekoId.namespace",
      "signatures": [
        {
          "parameters": [],
          "returnType": {
            "kind": "PRIMITIVE",
            "name": "string"
          }
        }
      ]
    },
    {
      "id": "member:NekoId.path",
      "signatures": [
        {
          "parameters": [],
          "returnType": {
            "kind": "PRIMITIVE",
            "name": "string"
          }
        }
      ]
    },
    {
      "id": "member:NekoId.asString",
      "signatures": [
        {
          "parameters": [],
          "returnType": {
            "kind": "PRIMITIVE",
            "name": "string"
          }
        }
      ]
    },
    {
      "id": "global:Platform",
      "signatures": [
        {
          "parameters": [],
          "returnType": {
            "kind": "PRIMITIVE",
            "name": "object"
          }
        }
      ]
    },
    {
      "id": "member:Platform.isClient",
      "signatures": [
        {
          "parameters": [],
          "returnType": {
            "kind": "PRIMITIVE",
            "name": "boolean"
          }
        }
      ]
    },
    {
      "id": "member:Platform.isDevelopment",
      "signatures": [
        {
          "parameters": [],
          "returnType": {
            "kind": "PRIMITIVE",
            "name": "boolean"
          }
        }
      ]
    },
    {
      "id": "member:Platform.getMcVersion",
      "signatures": [
        {
          "parameters": [],
          "returnType": {
            "kind": "PRIMITIVE",
            "name": "string"
          }
        }
      ]
    },
    {
      "id": "member:Platform.getLoaderId",
      "signatures": [
        {
          "parameters": [],
          "returnType": {
            "kind": "PRIMITIVE",
            "name": "string"
          }
        }
      ]
    },
    {
      "id": "member:Platform.getLoaderVersion",
      "signatures": [
        {
          "parameters": [],
          "returnType": {
            "kind": "PRIMITIVE",
            "name": "string"
          }
        }
      ]
    },
    {
      "id": "member:Platform.isLoaded",
      "signatures": [
        {
          "parameters": [
            {
              "name": "modId",
              "type": {
                "kind": "PRIMITIVE",
                "name": "string"
              }
            }
          ],
          "returnType": {
            "kind": "PRIMITIVE",
            "name": "boolean"
          }
        }
      ]
    },
    {
      "id": "member:Platform.getInfo",
      "signatures": [
        {
          "parameters": [
            {
              "name": "modId",
              "type": {
                "kind": "PRIMITIVE",
                "name": "string"
              }
            }
          ],
          "returnType": {
            "kind": "UNION",
            "arguments": [
              {
                "kind": "SYMBOL",
                "name": "type:ModInfo"
              },
              {